"SZRTS9Z2","journalArticle","2009","Pivato, Marcus","Twofold optimality of the relative utilitarian bargaining solution","Social Choice and Welfare","","1432-217X","10.1007/s00355-008-0313-0","https://doi.org/10.1007/s00355-008-0313-0","Given a bargaining problem, the relative utilitarian (RU) solution maximizes the sum total of the bargainer’s utilities, after having first renormalized each utility function to range from zero to one. We show that RU is “optimal” in two very different senses. First, RU is the maximal element (over the set of all bargaining solutions) under any partial ordering which satisfies certain axioms of fairness and consistency; this result is closely analogous to the result of Segal (J Polit Econ 108(3):569–589, 2000). Second, RU offers each person the maximum expected utility amongst all rescaling-invariant solutions, when it is applied to a random sequence of future bargaining problems generated using a certain class of distributions; this is recalls the results of Harsanyi (J Polit Econ 61:434–435, 1953) and Karni (Econometrica 66(6):1405–1415, 1998).","2009-01-01","2024-04-01 16:27:58","2024-04-01 16:27:58","","79-92","","1","32","","Social Choice and Welfare","","","","","","","","","","","","","","","","","","","","","","","","","","","","","","","","","","","","","","","","","","","","","","","","","","","","","","","","","","","","","","","","","",""
"S87A3JHP","journalArticle","2017","Yamamura, Hirofumi","Interpersonal comparison necessary for Arrovian aggregation","Social Choice and Welfare","","1432-217X","10.1007/s00355-017-1048-6","https://doi.org/10.1007/s00355-017-1048-6","While studies of social welfare functionals have shown that some interpersonal comparability such as ordinal and level comparability and cardinal and unit comparability resolves Arrow’s impossibility theorem, the kind of information necessary to solve this issue remains unclear. To address this shortcoming in the body of knowledge on this topic, the present study captures and then characterizes the features of informational structures that make available social welfare functionals satisfying Strong Pareto, Anonymity, and Independence of Irrelevant Alternatives. We know from this characterization that if utility levels are not interpersonally comparable, then transformed utility functions by a certain transformation need to be cardinal and unit comparable.","2017-06-01","2024-04-01 16:33:36","2024-04-01 16:33:36","","37-64","","1","49","","Social Choice and Welfare","","","","","","","","","","","","","","","","","","","","","","","","","","","","","","","","","","","","","","","","","","","","","","","","","","","","","","","","","","","","","","","","","",""
"3U385WUZ","journalArticle","2005","Bradley, Richard","Bayesian utilitarianism and probability homogeneity","Social Choice and Welfare","","1432-217X","10.1007/s00355-003-0300-4","https://doi.org/10.1007/s00355-003-0300-4","This paper investigates, within the axiomatic framework of Jeffrey-Bolker decision theory, two kinds of conditions and the relation between them: (1) The Utilitarian condition that social rankings of prospects be representable by an expected utility function that is a weighted sum of the expected utility functions representing individual rankings; and (2) Homogeneity conditions on the probabilities and preferences of individuals. In particular, we show that identity of individuals’ probabilities is necessary and sufficient for the Utilitarian condition to hold and that the homogeneity of individuals’ probabilities can be derived from a Pareto condition on the relation between individual and social rankings, provided that these rankings are separable in a particular sense.","2005-04-01","2024-04-01 16:34:50","2024-04-01 16:34:50","","221-251","","2","24","","Social Choice and Welfare","","","","","","","","","","","","","","","","","","","","","","","","","","","","","","","","","","","","","","","","","","","","","","","","","","","","","","","","","","","","","","","","","",""
"6FYG9UPV","journalArticle","1990","Segerstrom, P. S.","Moral efficiency","Social Choice and Welfare","","1432-217X","10.1007/BF01560578","https://doi.org/10.1007/BF01560578","This paper presents a new criterion for social choice which goes beyond pure efficiency considerations. Members of society are required to evaluate public policies impartially by putting themselves in other people's shoes. The impartial preferences that are constructed by means of these thought-experiments are used to rule out some unfair Pareto efficient public policies from consideration. Implications of this “moral efficiency” criterion are illustrated using a pure exchange society, a simple production society with redistributive income taxation and a medical research society. The relationship between the moral efficiency criterion and alternative theories of social choice is also discussed.","1990-04-01","2024-04-01 16:35:44","2024-04-01 16:35:44","","109-129","","2","7","","Social Choice and Welfare","","","","","","","","","","","","","","","","","","","","","","","","","","","","","","","","","","","","","","","","","","","","","","","","","","","","","","","","","","","","","","","","","",""
"EI77RZT2","journalArticle","1993","Weymark, John A.","Harsanyi's Social Aggregation Theorem and the Weak Pareto Principle","Social Choice and Welfare","","1432-217X","10.1007/BF00182506","https://doi.org/10.1007/BF00182506","Harsanyi's Social Aggregation Theorem is concerned with the aggregation of individual preferences defined on the set of lotteries generated from a finite set of basic prospects into a social preference. These preferences are assumed to satisfy the expected utility hypothesis and are represented by von Neumann-Morgenstern utility functions. Harsanyi's Theorem says that if Pareto Indifference is satisfied, then the social utility function must be an affine combination of the individual utility functions. This article considers the implications for Harsanyi's Theorem of replacing Pareto Indifference with Weak Pareto.","1993-07-01","2024-04-01 16:36:46","2024-04-01 16:36:46","","209-221","","3","10","","Social Choice and Welfare","","","","","","","","","","","","","","","","","","","","","","","","","","","","","","","","","","","","","","","","","","","","","","","","","","","","","","","","","","","","","","","","","",""
"39CUT27W","journalArticle","2013","Ahlert, Marlies; Funke, Katja; Schwettmann, Lars","Thresholds, productivity, and context: an experimental study on determinants of distributive behaviour","Social Choice and Welfare","","1432-217X","10.1007/s00355-012-0652-8","https://doi.org/10.1007/s00355-012-0652-8","In our questionnaire experiment we confronted students of economics, law and medicine with distributive situations in different contexts characterised by two features inspired by medical decision problems: First, individual threshold values indicate minimal amounts needed by potential recipients of the given resource to obtain positive benefits. Second, recipients differ with respect to their ability to benefit from the given quantity, which indicates the productivity of the resource. Allocations offered in the questionnaire are theoretically grounded. However, respondents were also able to make their own proposals. Well-known allocation rules, but also new procedures, were witnessed. Two multistage principles were most prominent: After distributing all minimal amounts, in a second step one aims for resource-equality while the other principle in the second step demands the maximisation of the sum of payoffs. Besides threshold values and productivity, the acceptance of different principles also depended on the field of study, the degree of scarcity of the resources and the sequential order of situations.","2013-04-01","2024-04-01 16:37:41","2024-04-01 16:37:41","","957-984","","4","40","","Social Choice and Welfare","","","","","","","","","","","","","","","","","","","","","","","","","","","","","","","","","","","","","","","","","","","","","","","","","","","","","","","","","","","","","","","","","",""
"VYH2PW5A","journalArticle","1988","Hammond, P. J.","Consequentialist demographic norms and parenting rights","Social Choice and Welfare","","1432-217X","10.1007/BF00735757","https://doi.org/10.1007/BF00735757","This paper extends the author's recent work on dynamically consistent consequentialist social norms for an unrestricted domain of decision trees with risk to trees in which the population is a variable consequence — i.e., endogenous. Given a form of ethical liberalism and ethical irrelevance of distant ancestors, classical utilitarianism is implied (provided also that a weak continuity condition is met). The “repugnant conclusion” that having many poor people may be desirable can be avoided by denying that individuals' interests extend to the circumstances of their birth. But it is better avoided by recognizing that potential parents have legitimate interests concerning the sizes of their families.","1988-06-01","2024-04-01 16:40:57","2024-04-01 16:40:57","","127-145","","2","5","","Social Choice and Welfare","","","","","","","","","","","","","","","","","","","","","","","","","","","","","","","","","","","","","","","","","","","","","","","","","","","","","","","","","","","","","","","","","",""
"3J66EWXI","journalArticle","2006","Bavetta, Sebastiano; Peragine, Vitorocco","Measuring autonomy freedom","Social Choice and Welfare","","1432-217X","10.1007/s00355-005-0027-5","https://doi.org/10.1007/s00355-005-0027-5","In the measurement of autonomy freedom, the admissible potential preference relations are elicited by means of the concept of ‘reasonableness’. In this paper we argue for an alternative criterion based on information about the decision maker’s ‘awareness’ of his available opportunities. We argue that such an interpretation of autonomy fares better than that based on reasonableness. We then introduce some axioms that capture this intuition and study their logical implications. In the process, a new measure of autonomy freedom is characterized, which generalizes some of the measures so far constructed in the literature.","2006-01-01","2024-04-01 16:42:05","2024-04-01 16:42:05","","31-45","","1","26","","Social Choice and Welfare","","","","","","","","","","","","","","","","","","","","","","","","","","","","","","","","","","","","","","","","","","","","","","","","","","","","","","","","","","","","","","","","","",""
"HD6Q5D2X","journalArticle","2004","Sugden, Robert","Living with unfairness: The limits of equal opportunity in a market economy","Social Choice and Welfare","","1432-217X","10.1007/s00355-003-0283-1","https://doi.org/10.1007/s00355-003-0283-1","Equality of opportunity is often presented as a criterion which reconciles egalitarianism with principles of freedom and responsibility. This paper distinguishes between the principle of ‘starting-line equality’, which requires that everyone’s initial opportunities, assessed in relation to what is publicly known ex ante, are equal, and the principle that equal efforts should yield equal ex post rewards. It argues that the first principle is compatible with allocation of resources through markets but, because of the division of knowledge, the second is not. If we want the opportunities which markets give us, we have to accept ex post unfairness.","2004-02-01","2024-04-01 16:43:13","2024-04-01 16:43:13","","211-236","","1","22","","Social Choice and Welfare","","","","","","","","","","","","","","","","","","","","","","","","","","","","","","","","","","","","","","","","","","","","","","","","","","","","","","","","","","","","","","","","","",""
"S3MYL9YA","journalArticle","2009","Konow, James","Is fairness in the eye of the beholder? An impartial spectator analysis of justice","Social Choice and Welfare","","1432-217X","10.1007/s00355-008-0348-2","https://doi.org/10.1007/s00355-008-0348-2","A popular sentiment is that fairness is inexorably subjective and incapable of being determined by objective standards. This study, on the other hand, seeks to establish evidence on unbiased justice and to propose and demonstrate a general approach for measuring impartial views empirically. Most normative justice theories associate impartiality with limited information and consensus. In both the normative and positive literature, information is usually seen as the raw material for self-serving bias and disagreement. In contrast, this paper proposes a type of impartiality that is associated with a high level of information and that results in consensus. The crucial distinction is the emphasis here on the views of impartial spectators, rather than implicated stakeholders. I describe the quasi-spectator method, i.e., an empirical means to approximate the views of impartial spectators. Results of a questionnaire provide evidence on quasi-spectator views and support this approach as a means to elicit moral preferences. By establishing a relationship between consensus and impartiality, this paper helps lay an empirical foundation for welfare analysis, social choice theory and practical policy applications.“There is no objective standard of ‘fairness.’ ‘Fairness’ is strictly in the eye of the beholder... To a producer or seller, a ‘fair’ price is a high price. To the buyer or consumer, a ‘fair’ price is a low price. How is the conflict to be adjudicated?” – Milton Friedman, Newsweek, July 4, 1977.","2009-06-01","2024-04-01 16:44:06","2024-04-01 16:44:06","","101-127","","1","33","","Social Choice and Welfare","","","","","","","","","","","","","","","","","","","","","","","","","","","","","","","","","","","","","","","","","","","","","","","","","","","","","","","","","","","","","","","","","",""
"J37RTGJ6","journalArticle","1985","Tesfatsion, L.","Fair division with uncertain needs and tastes","Social Choice and Welfare","","1432-217X","10.1007/BF00292692","https://doi.org/10.1007/BF00292692","Previous studies have shown that egalitarianism maximizes expected social welfare in a contractarian original position with equally likely risk-averse agent tastes. The present paper characterizes agents by subsistence needs as well as by tastes, allows infinitely many possible need and taste profiles, and weakens the requirement that all possibilities be perceived as equally likely. Surplusegalitarianism (meeting needs, then equally dividing the remainder) is shown to maximize expected social welfare when tastes are uncertain and needs are known, can be met, and are a priori required to be met; but intuitively unfair allocations may result if either of the latter two conditions fails to hold. Conditions under which egalitarianism maximizes expected social welfare with needs and tastes both uncertain are also determined.","1985-12-01","2024-04-01 16:44:56","2024-04-01 16:44:56","","295-309","","4","2","","Social Choice and Welfare","","","","","","","","","","","","","","","","","","","","","","","","","","","","","","","","","","","","","","","","","","","","","","","","","","","","","","","","","","","","","","","","","",""
"XWTI3YHN","journalArticle","2003","Chavas, Jean-Paul; Coggins, Jay","On fairness and welfare analysis under uncertainty","Social Choice and Welfare","","1432-217X","10.1007/s003550200176","https://doi.org/10.1007/s003550200176","This paper investigates the role of fairness, uncertainty, and a “veil of ignorance” in efficient resource allocation. It focuses on the choice of private and public goods, the method of financing, as well as the choice of information available for public decision-making. A fair-equivalent and Pareto efficient allocation is presented using a maximin criterion defined in terms of individual willingness-to-pay. The paper investigates the role of information in public decision making in terms of its implications for both efficiency and fairness. While better information typically generates improved efficiency, it can also contribute to unfair allocations. The effects of asymmetric information are discussed.","2003-03-01","2024-04-01 16:46:34","2024-04-01 16:46:34","","203-228","","2","20","","Social Choice and Welfare","","","","","","","","","","","","","","","","","","","","","","","","","","","","","","","","","","","","","","","","","","","","","","","","","","","","","","","","","","","","","","","","","",""
"AYPWBV8Z","journalArticle","2018","Sun, Ching-jen","The bargaining correspondence: when Edgeworth meets Nash","Social Choice and Welfare","","1432-217X","10.1007/s00355-018-1119-3","https://doi.org/10.1007/s00355-018-1119-3","A new, more fundamental approach is proposed to the classical bargaining problem. The give-and-take feature in the negotiation process is explicitly modelled under the new framework. A compromise set consists of all allocations a player is willing to accept as agreement. We focus on the relationship between the rationality principles (arguments) adopted by players in making mutual concessions and the formation of compromise sets. The bargaining correspondence is then defined as the intersection of players’ compromise sets. We study the non-emptiness, symmetry, efficiency and single-valuedness of the bargaining correspondence, and establish its connection to the Nash solution. Our framework provides a rational foundation to Nash’s axiomatic approach.","2018-08-01","2024-04-01 16:47:20","2024-04-01 16:47:20","","337-359","","2","51","","Social Choice and Welfare","","","","","","","","","","","","","","","","","","","","","","","","","","","","","","","","","","","","","","","","","","","","","","","","","","","","","","","","","","","","","","","","","",""
"YBRIJ8RG","journalArticle","1999","Kemp, Murray C.; Pezanis-Christou, Paul","Pareto's compensation principle","Social Choice and Welfare","","1432-217X","10.1007/s003550050154","https://doi.org/10.1007/s003550050154","Pareto is sometimes credited with an early formulation of the ill-fated Hicks or Kaldor principles of hypothetical compensation. The basis for this claim is Pareto's 1894 article “Il massimo di utilità dato dalla libera concorrenza.” However in that paper Pareto argued to the contrary, that in the formulation of economic policy compensation should be a consideration only if it is carried out. Our purpose is to document this claim.","1999-05-01","2024-04-01 16:50:08","2024-04-01 16:50:08","","441-444","","3","16","","Social Choice and Welfare","","","","","","","","","","","","","","","","","","","","","","","","","","","","","","","","","","","","","","","","","","","","","","","","","","","","","","","","","","","","","","","","","",""
"SLCQVV9R","journalArticle","2006","Heyd, David; Segal, Uzi","Democratically Elected Aristocracies","Social Choice and Welfare","","1432-217X","10.1007/s00355-006-0109-z","https://doi.org/10.1007/s00355-006-0109-z","The article suggests a formal model of a two-tier voting procedure, which unlike traditional voting systems does not presuppose that every vote counts the same. In deciding a particular issue voters are called in the first round to assign categories of their fellow-citizens with differential voting power (or weights) according to the special position or concern individuals are perceived to have with regard to that issue. In the second stage, voters vote on the issue itself according to their substantive view and their votes are counted in the light of the differential weights assigned in the first round. We analyze formal and philosophical reasons that support the model.","2006-08-01","2024-04-01 16:51:04","2024-04-01 16:51:04","","103-127","","1","27","","Social Choice and Welfare","","","","","","","","","","","","","","","","","","","","","","","","","","","","","","","","","","","","","","","","","","","","","","","","","","","","","","","","","","","","","","","","","",""
"FEN8T8PF","journalArticle","2014","Calo-Blanco, Aitor","Fairness, freedom, and forgiveness in health care","Social Choice and Welfare","","1432-217X","10.1007/s00355-013-0774-7","https://doi.org/10.1007/s00355-013-0774-7","This paper focuses on the optimal allocation between health and lifestyle choices when society is concerned about forgiveness. Based on the idea of fresh starts, we construct a social ordering that permits us to make welfare assessments when it is acceptable to compensate individuals who have mismanaged their initial resources. Our social rule also allows for the inclusion of the fairness and responsibility approach in the model. Grounded on basic ethical principles, we propose the application of the minimax criterion to the existing distance between the individual’s final bundle and her ideal choice.","2014-06-01","2024-04-01 16:52:10","2024-04-01 16:52:10","","141-151","","1","43","","Social Choice and Welfare","","","","","","","","","","","","","","","","","","","","","","","","","","","","","","","","","","","","","","","","","","","","","","","","","","","","","","","","","","","","","","","","","",""
"JH9XI97D","journalArticle","2008","Amiel, Yoram; Cowell, Frank; Davidovitz, Liema; Polovin, Avraham","Preference reversals and the analysis of income distributions","Social Choice and Welfare","","1432-217X","10.1007/s00355-007-0234-3","https://doi.org/10.1007/s00355-007-0234-3","It is known from the literature on uncertainty that in cases where individuals express a preference for a high win-probability bet over a bet with high winnings they nevertheless will bid more to obtain the bet with high winnings. We investigate whether a similar phenomenon applies in the parallel social-choice situation. Here decisions are to be made between a distribution with a large group of high-income people and a distribution with a small group of very high-income people. Results from a number of experimental designs are analysed. We are grateful for helpful comments from three referees of this journal, Peter Dolton, Graham Loomes, Dirk Van der gaer and seminar participants at the LSE and the University of Gent. We also thank Guillermo Cruces for computational assistance.","2008-02-01","2024-04-01 16:53:13","2024-04-01 16:53:13","","305-330","","2","30","","Social Choice and Welfare","","","","","","","","","","","","","","","","","","","","","","","","","","","","","","","","","","","","","","","","","","","","","","","","","","","","","","","","","","","","","","","","","",""
"XEE3GRMJ","journalArticle","1991","Bossert, W.","On intra- and interpersonal utility comparisons","Social Choice and Welfare","","1432-217X","10.1007/BF00177659","https://doi.org/10.1007/BF00177659","In this paper, it is suggested to formulate assumptions on the comparability of individual utilities in terms of meaningful statements rather than using the usual way of defining such assumptions by means of certain sets of admissible transformations. Various assumptions involving intra- and interpersonal comparisons of utility levels and utility differences are introduced in terms of meaningful statements and compared to their “traditional” counterparts. It is shown that these two approaches are, in general, not equivalent. In a social choice framework, it is demonstrated that the difference between these approaches can be quite substantial: replacing the usual cardinal unit comparability assumption by a condition involving comparisons of utility differences which is similar in spirit turns a well-known characterization of the utilitarian social welfare functional into an impossibility theorem.","1991-07-01","2024-04-01 16:54:17","2024-04-01 16:54:17","","207-219","","3","8","","Social Choice and Welfare","","","","","","","","","","","","","","","","","","","","","","","","","","","","","","","","","","","","","","","","","","","","","","","","","","","","","","","","","","","","","","","","","",""
"4HZHZNGS","journalArticle","1985","Svensson, L. -G.","The utilitarian criterion, finite sensibility, and the weak majority preference principle","Social Choice and Welfare","","1432-217X","10.1007/BF00433764","https://doi.org/10.1007/BF00433764","This study is a further analysis of the approach taken by Yew-Kwang Ng to derive the utilitarian criterion. Specific for the model is that individual preferences are finitely sensible. In this framweork an analysis of the consequences on social preferences when different kinds of value premises are imposed is made. It is found that the utilitarian criterion is the unique consequence only for very special choices of the value premise. In addition, uniqueness requires the “underlying preferences” be cardinal. It is also found that finite sensibility induces approximate cardinalization of preferences.","1985-05-01","2024-04-01 16:55:05","2024-04-01 16:55:05","","23-35","","1","2","","Social Choice and Welfare","","","","","","","","","","","","","","","","","","","","","","","","","","","","","","","","","","","","","","","","","","","","","","","","","","","","","","","","","","","","","","","","","",""
