"Key","Item Type","Publication Year","Author","Title","Publication Title","ISBN","ISSN","DOI","Url","Abstract Note","Date","Date Added","Date Modified","Access Date","Pages","Num Pages","Issue","Volume","Number Of Volumes","Journal Abbreviation","Short Title","Series","Series Number","Series Text","Series Title","Publisher","Place","Language","Rights","Type","Archive","Archive Location","Library Catalog","Call Number","Extra","Notes","File Attachments","Link Attachments","Manual Tags","Automatic Tags","Editor","Series Editor","Translator","Contributor","Attorney Agent","Book Author","Cast Member","Commenter","Composer","Cosponsor","Counsel","Interviewer","Producer","Recipient","Reviewed Author","Scriptwriter","Words By","Guest","Number","Edition","Running Time","Scale","Medium","Artwork Size","Filing Date","Application Number","Assignee","Issuing Authority","Country","Meeting Name","Conference Name","Court","References","Reporter","Legal Status","Priority Numbers","Programming Language","Version","System","Code","Code Number","Section","Session","Committee","History","Legislative Body"
"ZZLJFSQ5","journalArticle","1995","Weymark, John A.","John Harsanyi's contributions to social choice and welfare economics","Social Choice and Welfare","","1432-217X","10.1007/BF00186276","https://doi.org/10.1007/BF00186276","This article provides an overview of John Harsanyi's contributions to Social Choice and Welfare Economics.","1995-10-01","2024-03-31 21:31:18","2024-03-31 21:31:18","","313-318","","4","12","","Social Choice and Welfare","","","","","","","","","","","","","","","","","","","","","","","","","","","","","","","","","","","","","","","","","","","","","","","","","","","","","","","","","","","","","","","","","",""
"E6ZU6QSY","journalArticle","1987","Kelly, J. S.","An interview with Kenneth J. Arrow","Social Choice and Welfare","","1432-217X","10.1007/BF00433955","https://doi.org/10.1007/BF00433955","","1987-03-01","2024-03-31 21:33:35","2024-03-31 21:33:35","","43-62","","1","4","","Social Choice and Welfare","","","","","","","","","","","","","","","","","","","","","","","","","","","","","","","","","","","","","","","","","","","","","","","","","","","","","","","","","","","","","","","","","",""
"PB7TJNSC","journalArticle","1993","Broome, John","A cause of preference is not an object of preference","Social Choice and Welfare","","1432-217X","10.1007/BF00187433","https://doi.org/10.1007/BF00187433","Welfare economists sometimes treat a cause of preference as an object of preference. This paper explains that this is an error. It examines two examples where the error has occurred. One is from the theory of endogenous preferences. The other is from the theory of extended preferences. People have erroneously been led to believe that everyone must have the same extended preferences, and this has led them to think that extended preferences can be the basis of interpersonal comparisons of wellbeing. But actually the basis of interpersonal comparisons must come from elsewhere.","1993-01-01","2024-03-31 21:36:39","2024-03-31 21:36:39","","57-68","","1","10","","Social Choice and Welfare","","","","","","","","","","","","","","","","","","","","","","","","","","","","","","","","","","","","","","","","","","","","","","","","","","","","","","","","","","","","","","","","","",""
"KFNCT7MH","conferencePaper","1988","Dasgupta, P.","Lives and Well-Being","Distributive Justice and Inequality","978-3-642-73816-6","","","","This article attempts to use the analytical framework of social choice theory for exploring the ethical foundations of population policies. It is argued that non-existence is not a state and therefore that different numbers problems are conceptionally different from same numbers problems that concern much theoretical welfare economics. By means of examples it is argued that we should not expect to find an overall ethical ordering of social states when the sizç of future generations is subject to choice.","1988","2024-03-31 21:39:17","2024-03-31 21:39:17","","15-38","","","","","","","","","","","Springer Berlin Heidelberg","Berlin, Heidelberg","","","","","","","","","","","","","","Gaertner, Wulf; Pattanaik, Prasanta K.","","","","","","","","","","","","","","","","","","","","","","","","","","","","","","","","","","","","","","","","","","","","",""
"FB4F67CV","journalArticle","1992","Guttman, Joel M.; Schnytzer, Adi","A solution of the externality problem using strategic matching","Social Choice and Welfare","","1432-217X","10.1007/BF00177674","https://doi.org/10.1007/BF00177674","This paper develops a Coase-like solution of the problem of inducing Pareto optimal behavior in the presence of reciprocal externalities. In place of Coasean direct compensation between the parties to an externality problem, actors strategically match each other's externality-producing activity, and thus induce counterparts to internalize the external benefits or costs of their actions. The analysis suggests a general framework for analyzing social interactions in the presence of reciprocal externalities. As an application of the theory, a solution of the duopoly problem is noted.","1992-01-01","2024-03-31 21:40:14","2024-03-31 21:40:14","","73-88","","1","9","","Social Choice and Welfare","","","","","","","","","","","","","","","","","","","","","","","","","","","","","","","","","","","","","","","","","","","","","","","","","","","","","","","","","","","","","","","","","",""
"YU453GXR","journalArticle","2012","Sen, Amartya","The reach of social choice theory","Social Choice and Welfare","","1432-217X","10.1007/s00355-011-0613-7","https://doi.org/10.1007/s00355-011-0613-7","","2012-07-01","2024-04-01 09:26:40","2024-04-01 09:26:40","","259-272","","2","39","","Social Choice and Welfare","","","","","","","","","","","","","","","","","","","","","","","","","","","","","","","","","","","","","","","","","","","","","","","","","","","","","","","","","","","","","","","","","",""
"NM9VD7AT","journalArticle","1989","Cowen, T.","Normative population theory","Social Choice and Welfare","","1432-217X","10.1007/BF00433361","https://doi.org/10.1007/BF00433361","Utilitarian and contractarian solutions to the problem of optimal population are examined and shown to have unacceptable implications. As argued by Parfit, for instance, utilitarianism may imply large numbers of people at a very low standard of living. An analogy is drawn between optimal population for a society and the optimal structure of an individual life. The ideal life need not maximize cardinal utility, because an individual may prefer a shorter life with less, more intense utility to a very long life with higher total utility (“Methuselah's Paradox”). The optimal population is what an individual would prefer if he had to sequentially live out each life in his choice.","1989-01-01","2024-04-01 09:28:02","2024-04-01 09:28:02","","33-43","","1","6","","Social Choice and Welfare","","","","","","","","","","","","","","","","","","","","","","","","","","","","","","","","","","","","","","","","","","","","","","","","","","","","","","","","","","","","","","","","","",""
"U39U6YGX","journalArticle","2013","Calvo, Cesar; Dercon, Stefan","Vulnerability to individual and aggregate poverty","Social Choice and Welfare","","1432-217X","10.1007/s00355-012-0706-y","https://doi.org/10.1007/s00355-012-0706-y","We propose families of measures for vulnerability to both individual and aggregate poverty. We view vulnerability as the burden caused by the threat of poverty. Exposure to states of the world where hardship may strike causes distress ex-ante, even if ex-post the dice are benign and poverty (consumption below a critical norm) does not materialise. We ensure our measures meet a set of desirable axioms—in the case of aggregate vulnerability, this set includes sensitivity to the degree of correlation of outcomes across individuals. We argue that individual vulnerability levels are not enough to compose the aggregate picture, e.g. because society may be wary of the threat of simultaneous, widespread poverty. We illustrate with data from Ethiopia, where rainfall risks are found to raise vulnerability to poverty despite sustained increases in consumption.","2013-10-01","2024-04-01 09:29:03","2024-04-01 09:29:03","","721-740","","4","41","","Social Choice and Welfare","","","","","","","","","","","","","","","","","","","","","","","","","","","","","","","","","","","","","","","","","","","","","","","","","","","","","","","","","","","","","","","","","",""
"SIFQIYWI","journalArticle","2014","Valletta, Giacomo","Health, fairness and taxation","Social Choice and Welfare","","1432-217X","10.1007/s00355-013-0768-5","https://doi.org/10.1007/s00355-013-0768-5","We consider a model where agents differ in their preferences about consumption labor and health, in their (health-dependent) earning ability, and in their health disposition. We study the joint taxation of income and health expenditure, under incentive-compatibility constraints, on the basis of efficiency and fairness principles. The fairness principles we consider propose, on one side, to reduce inequalities deriving from factors that do not depend on individuals’ responsibility. On the other side, redistribution should be precluded at least when all agents in the economy have equal physical characteristics. We construct, on the basis of such principles, a particular social welfare function. Then we give the explicit formula for the comparison of tax policies: we prove that a tax reform should always benefit agents with the worst earning ability and the worst health disposition first. Finally, in some cases, at the bottom of the income distribution the optimal tax scheme should exhibit non-uniform tax rates over health expenditure and non-positive average marginal tax rates over income.","2014-06-01","2024-04-01 09:32:26","2024-04-01 09:32:26","","101-140","","1","43","","Social Choice and Welfare","","","","","","","","","","","","","","","","","","","","","","","","","","","","","","","","","","","","","","","","","","","","","","","","","","","","","","","","","","","","","","","","","",""
"UACLXVDQ","journalArticle","2003","Ng, Yew-Kwang","From preference to happiness: Towards a more complete welfare economics","Social Choice and Welfare","","1432-217X","10.1007/s003550200184","https://doi.org/10.1007/s003550200184","Welfare economics is incomplete as it analyzes preference without going on to analyze welfare (or happiness) which is the ultimate objective. Preference and welfare may differ due to imperfect knowledge, imperfect rationality, and/or a concern for the welfare of others (non-affective altruism). Imperfection in knowledge and rationality has a biological basis and the resulting accumulation instinct amplifies with advertising-fostered consumerism to result in a systematic materialistic bias, as supported by recent evidence on happiness and quality of life. Such a bias, in combination with relative-income effects, environmental disruption effects, and over-estimation of the excess burden of taxation, results in the over-spending on private consumption and under-provision of public goods, and may make economic growth welfare-reducing. A cost-benefit analysis aiming even just at preference maximization should offset the excess burden of financing for public projects by the indirect effect through the relative-income effect and by the environmental disruption effect. A cost-benefit analysis aiming at welfare maximization should, in addition, adjust the marginal consumption benefits of public projects upward by a proportion determined by the proportionate excess of marginal utility over marginal welfare of consumption. The environmental disruption effects have also to be similarly adjusted upward. However, the productive contributions of public projects should not be so adjusted.","2003-03-01","2024-04-01 09:33:38","2024-04-01 09:33:38","","307-350","","2","20","","Social Choice and Welfare","","","","","","","","","","","","","","","","","","","","","","","","","","","","","","","","","","","","","","","","","","","","","","","","","","","","","","","","","","","","","","","","","",""
"89GHLNEN","journalArticle","1990","Cowen, T.","Distribution in fixed and variable number problems","Social Choice and Welfare","","1432-217X","10.1007/BF01832920","https://doi.org/10.1007/BF01832920","Analogies are drawn between analyses of distribution where the number of individuals is fixed and the number of individuals varies (i.e., population theory); the theory of optimal population is fundamentally a problem of distribution. I examine the use of Harsanyi's veil of ignorance to evaluate different population patterns and whether ex ante preferences across uncertain outcomes are a useful source of moral information about outcomes. If we accept the premise that individuals should maximize expected welfare, Parfit's Repugnant Conclusion follows from very weak assumptions.","1990-03-01","2024-04-01 09:34:41","2024-04-01 09:34:41","","47-56","","1","7","","Social Choice and Welfare","","","","","","","","","","","","","","","","","","","","","","","","","","","","","","","","","","","","","","","","","","","","","","","","","","","","","","","","","","","","","","","","","",""
"WN4GHUMB","journalArticle","1994","Kolm, S. -C.","The meaning of “fundamental preferences”","Social Choice and Welfare","","1432-217X","10.1007/BF00193804","https://doi.org/10.1007/BF00193804","We present the definition and meaning of “fundamental preferences” that are interpersonally comparable, ordinal and endemonistic. We also dispel a number of misunderstandings concerning them. In the article “A cause of preference is not on object of preference” (Soc Choice Welfare (1993) 10: 57–68), Professor Broome misinterprets the notion of “fundamental preferences” in confusing an observer's device for a psychological transformation of the observed (as if an economist studying wealth meant that he becomes wealthy, or if physicians had to be sick — this is well shown in his interpretation of a sentence of mine in p 65 where the crucial switch to the first person is his own). Considering a new set of variables that includes both structural parameters and former variables, hence variables of different kinds, assumes nothing new concerning the observed object; namely, it says neither that the consumption of bread becomes “a cause” of the taste for jam, nor that the individual likes (or dislikes) his own tastes, or anything like this (the accusation of “fantasy”). We shall suggest that certain other views receive a similar treatment in this paper. This misunderstanding is regrettable, since the consideration of fundamental preferences is unavoidable in social ethics, both when one has to compare all-encompassing individual situations, and for the preferences of the hypothetical identical individuals in an Original Position device where they evaluate at once what they might have and what they might beI wish to thank Professor Broome for comments on an earlier version of this note..","1994-07-01","2024-04-01 09:37:09","2024-04-01 09:37:09","","193-198","","3","11","","Social Choice and Welfare","","","","","","","","","","","","","","","","","","","","","","","","","","","","","","","","","","","","","","","","","","","","","","","","","","","","","","","","","","","","","","","","","",""
"24L325GB","journalArticle","1999","Ng, Yew-Kwang","Utility, informed preference, or happiness: Following Harsanyi's argument to its logical conclusion","Social Choice and Welfare","","1432-217X","10.1007/s003550050140","https://doi.org/10.1007/s003550050140","Harsanyi (1997) argues that, for normative issues, informed preferences should be used, instead of actual preferences or happiness (or welfare). Following his argument allowing him to move from actual to informed preferences to its logical conclusion forces us to use happiness instead. Where informed preferences differ from happiness due to a pure concern for the welfare of others, using the former involves multiple counting. This “concerning effect” (non-affective altruism) differs from and could be on top of the “minding effect” (affective altruism) of being happy seeing or helping others to be happy. The concerning/minding effect should be excluded/included in social decision. Non-affective altruism is shown to exist in a compelling hypothetical example. Just as actual preferences should be discounted due to the effects of ignorance and spurious preferences, informed preferences should also be discounted due to some inborn or acquired tendencies to be irrational, such as placing insufficient weights on the welfare of the future, maximizing our biological fitness instead of our welfare. Harsanyi's old result on utilitarianism is however defended against criticisms in the last decade.","1999-02-01","2024-04-01 09:38:41","2024-04-01 09:38:41","","197-216","","2","16","","Social Choice and Welfare","","","","","","","","","","","","","","","","","","","","","","","","","","","","","","","","","","","","","","","","","","","","","","","","","","","","","","","","","","","","","","","","","",""
"5VAEEUHC","journalArticle","1994","Kolm, Serge-Christophe","Rejoinder to John Broome","Social Choice and Welfare","","1432-217X","10.1007/BF00193806","https://doi.org/10.1007/BF00193806","","1994-07-01","2024-04-01 09:39:15","2024-04-01 09:39:15","","203-204","","3","11","","Social Choice and Welfare","","","","","","","","","","","","","","","","","","","","","","","","","","","","","","","","","","","","","","","","","","","","","","","","","","","","","","","","","","","","","","","","","",""
"6JPZKAZN","journalArticle","2004","Weikard, Hans-Peter","On the economics of basic liberties","Social Choice and Welfare","","1432-217X","10.1007/s00355-003-0286-y","https://doi.org/10.1007/s00355-003-0286-y","The paper discusses the problem of initial assignments of rights. An attempt is made to characterise a system of rights in the spirit of Rawls’s first principle of justice according to which society should adopt the most extensive system of equal basic liberties.","2004-02-01","2024-04-01 09:41:12","2024-04-01 09:41:12","","267-280","","1","22","","Social Choice and Welfare","","","","","","","","","","","","","","","","","","","","","","","","","","","","","","","","","","","","","","","","","","","","","","","","","","","","","","","","","","","","","","","","","",""
"UGGXTK9G","journalArticle","1992","Ng, Yew-Kwang","Utilitarianism and interpersonal comparison","Social Choice and Welfare","","1432-217X","10.1007/BF00177666","https://doi.org/10.1007/BF00177666","Beliefs in the impossibility of interpersonal comparison of welfare and the unacceptability of utilitarianism are based on a non-materialist solution to the theory of mind, i.e. on the existence of a soul. The compellingness of the theory of evolution and some discoveries in brain sciences render (philosophical) materialism very persuasive. The acceptance of materialism implies the negation of free will, non-significance of the self (no substantial reason to care much more about the welfare of one's own future self than the welfare of others), possibility of interpersonal comparison of welfare, compellingness of utilitarianism, and the possibility of conscious machines. Searle's argument on the impossibility of rigorous social sciences is however rejected.","1992-01-01","2024-04-01 09:41:51","2024-04-01 09:41:51","","1-15","","1","9","","Social Choice and Welfare","","","","","","","","","","","","","","","","","","","","","","","","","","","","","","","","","","","","","","","","","","","","","","","","","","","","","","","","","","","","","","","","","",""
"TZFTDZVP","journalArticle","1994","Broome, John","Reply to Kolm","Social Choice and Welfare","","1432-217X","10.1007/BF00193805","https://doi.org/10.1007/BF00193805","This paper mentions some of the points of agreement between Serge-Christophe Kolm and me, and explains the one point of disagreement. It also explains why I concentrated on this one point.","1994-07-01","2024-04-01 09:43:14","2024-04-01 09:43:14","","199-201","","3","11","","Social Choice and Welfare","","","","","","","","","","","","","","","","","","","","","","","","","","","","","","","","","","","","","","","","","","","","","","","","","","","","","","","","","","","","","","","","","",""
"66YVUVFG","journalArticle","2012","Lambert, Peter J.","An interview with Serge-Christophe Kolm","Social Choice and Welfare","","1432-217X","10.1007/s00355-010-0518-x","https://doi.org/10.1007/s00355-010-0518-x","","2012-01-01","2024-04-01 16:22:11","2024-04-01 16:22:11","","59-83","","1","38","","Social Choice and Welfare","","","","","","","","","","","","","","","","","","","","","","","","","","","","","","","","","","","","","","","","","","","","","","","","","","","","","","","","","","","","","","","","","",""
"ZAQF56KF","journalArticle","2012","Frey, Bruno S.; Stutzer, Alois","The use of happiness research for public policy","Social Choice and Welfare","","1432-217X","10.1007/s00355-011-0629-z","https://doi.org/10.1007/s00355-011-0629-z","Research on happiness tends to follow a “benevolent dictator” approach where politicians pursue people’s happiness. This paper takes an antithetic approach based on the insights of public choice theory. First, we inquire how the results of happiness research may be used to improve the choice of institutions. Second, we show that the policy approach matters for the choice of research questions and the kind of knowledge happiness research aims to provide. Third, we emphasize that there is no shortcut to an optimal policy maximizing some happiness indicator or social welfare function since governments have an incentive to manipulate this indicator.","2012-04-01","2024-04-01 16:23:43","2024-04-01 16:23:43","","659-674","","4","38","","Social Choice and Welfare","","","","","","","","","","","","","","","","","","","","","","","","","","","","","","","","","","","","","","","","","","","","","","","","","","","","","","","","","","","","","","","","","",""
"5L8CMV3C","journalArticle","1996","Harsanyi, John C.","Utilities, preferences, and substantive goods","Social Choice and Welfare","","1432-217X","10.1007/s003550050057","https://doi.org/10.1007/s003550050057","People’s utility levels are meant to be measures of their well-being. Early utilitarians defined them in terms of people’s happiness. Modern economics defines them in terms of people’s actual preferences. But in ethics they have to be defined in terms of people’s informed preferences. I shall discuss the relationship between people’s desires and preferences, and that between their reasoned and unreasoned preferences. I shall argue that people’s basic desires are much the same, whereas their preferences are often very different. Finally, I shall argue, contrary to Scanlon’s theory, that the things that are good for us are beneficial to us ultimately because they satisfy our biological and psychological needs and our personal interests.","1996-12-01","2024-04-01 16:24:47","2024-04-01 16:24:47","","129-145","","1","14","","Social Choice and Welfare","","","","","","","","","","","","","","","","","","","","","","","","","","","","","","","","","","","","","","","","","","","","","","","","","","","","","","","","","","","","","","","","","",""
"72JEHXIK","journalArticle","2004","Barrett, Richard; Petron-Brunel, Anne; Salles, Maurice","A new approach to rights in social choice theory which incorporates utilitarianism","Social Choice and Welfare","","1432-217X","10.1007/s00355-003-0274-2","https://doi.org/10.1007/s00355-003-0274-2","The paper axiomatises a generalised utilitarian aggregation rule, under which different weights are assigned to utilities depending on the different rights involved. The relationship between actions, rights and the evaluation of utilities is investigated. Application is made to a famous example, Edwin-Angelina-the Judge, which appears in the social choice literature.","2004-02-01","2024-04-01 16:25:50","2024-04-01 16:25:50","","17-28","","1","22","","Social Choice and Welfare","","","","","","","","","","","","","","","","","","","","","","","","","","","","","","","","","","","","","","","","","","","","","","","","","","","","","","","","","","","","","","","","","",""
"CNQTKJ6X","journalArticle","2001","Ng, Siang; Ng, Yew-Kwang","Welfare-reducing growth despite individual and government optimization","Social Choice and Welfare","","1432-217X","10.1007/s003550000081","https://doi.org/10.1007/s003550000081","In the presence of substantial relative-income effects and environmental disruption effects, economic growth may be welfare-reducing even if each and all individuals are optimizing and eagerly trying to make more money and the government also maximizes the welfare of individuals by the choice of income-tax rate and the ratio devoted to the abatement of environmental disruption. Welfare-reducing growth may be avoided if environmental disruption may be directed taxed at low costs and/or government spending on public goods is not environmentally disruptive.","2001-07-01","2024-04-01 16:26:49","2024-04-01 16:26:49","","497-506","","3","18","","Social Choice and Welfare","","","","","","","","","","","","","","","","","","","","","","","","","","","","","","","","","","","","","","","","","","","","","","","","","","","","","","","","","","","","","","","","","",""
